{
  "version": "1",
  "issuer": {
    "issuer_id": "company:acme-eu",
    "display_name": "ACME Europe SARL",
    "trust_anchor_id": "registry:acme-trust-root"
  },
  "document": {
    "document_id": "INV-2026-000184",
    "document_type": "invoice",
    "beneficiary_name": "ACME Europe SARL",
    "iban": "BE68 5390 0754 7034",
    "amount": 1499.95,
    "currency": "EUR",
    "reference": "RF18539007547034",
    "due_date": "2026-07-15",
    "transaction_id": "TX-2026-06-25-000184",
    "communication": "Invoice INV-2026-000184"
  },
  "intent": "payment",
  "issued_at": "2026-06-25T10:00:00Z",
  "expires_at": "2026-07-15T23:59:59Z",
  "nonce": "vector-payment-valid",
  "alg": "Ed25519",
  "sig": "BASE64URL_SIGNATURE_PLACEHOLDER"
}
